[
  {
    "id": "checkout-flow-redesign",
    "name": "Checkout Flow Redesign",
    "url": "https://figma.com/file/replace-with-real-link",
    "description": "Q3 checkout redesign, mobile-first exploration",
    "created_at": "2026-08-11T14:00:00Z",
    "updated_at": "2026-08-11T14:00:00Z",
    "tags": ["figma", "checkout", "mobile"]
  }
]
